date;match;link_jp;show;arena;other_data;link_en;ID
2017.07.04;Satoshi Kojima vs Tomoyuki Oka;http://njpwworld.com/p/s_series_00446_1_05;Lion's Gate Project: 7;Shinjuku FACE;;;1358
2017.07.04;YOSHI-HASHI vs Koji Iwamoto;http://njpwworld.com/p/s_series_00446_1_06;Lion's Gate Project: 7;Shinjuku FACE;;;1359
2017.07.04;Yuji Nagata vs GO Asakawa;http://njpwworld.com/p/s_series_00446_1_07;Lion's Gate Project: 7;Shinjuku FACE;;;1360
2017.07.17;Tenzan, Kojima & Liger vs Elgin, Juice & Finlay;http://njpwworld.com/p/s_series_00447_1_01;G1 Climax Day 1;Hokkaido Sports Center;;https://njpwworld.com/p/s_series_00447_2_01;1361
2017.07.17;SANADA & BUSHI vs EVIL & Hiromu;http://njpwworld.com/p/s_series_00447_1_03;G1 Climax Day 1;Hokkaido Sports Center;;https://njpwworld.com/p/s_series_00447_2_03;1362
2017.07.17;Yuji Nagata vs YOSHI-HASHI;http://njpwworld.com/p/s_series_00447_1_05;G1 Climax Day 1;Hokkaido Sports Center;G1 Climax Block A Match;https://njpwworld.com/p/s_series_00447_2_05;1363
2017.07.17;Hirooki Goto vs Tomohiro Ishii;http://njpwworld.com/p/s_series_00447_1_07;G1 Climax Day 1;Hokkaido Sports Center;G1 Climax Block A Match;https://njpwworld.com/p/s_series_00447_2_07;1364
2017.07.17;Hiroshi Tanahashi vs Zack Sabre Jr.;http://njpwworld.com/p/s_series_00447_1_08;G1 Climax Day 1;Hokkaido Sports Center;G1 Climax Block A Match;https://njpwworld.com/p/s_series_00447_2_08;1365
2017.07.17;Kota Ibushi vs Tetsuya Naito;http://njpwworld.com/p/s_series_00447_1_09;G1 Climax Day 1;Hokkaido Sports Center;G1 Climax Block A Match;https://njpwworld.com/p/s_series_00447_2_09;1366
2017.07.20;Kota Ibushi & Hirai Kawato vs Zack Sabre Jr. & El Desperado;http://njpwworld.com/p/s_series_00447_3_01;G1 Climax Day 2;Korakuen Hall;;https://njpwworld.com/p/s_series_00447_4_01;1367
2017.07.20;Satoshi Kojima vs Juice Robinson;http://njpwworld.com/p/s_series_00447_3_05;G1 Climax Day 2;Korakuen Hall;G1 Climax Block B Match;https://njpwworld.com/p/s_series_00447_4_05;1368
2017.07.20;SANADA vs EVIL;http://njpwworld.com/p/s_series_00447_3_07;G1 Climax Day 2;Korakuen Hall;G1 Climax Block B Match;https://njpwworld.com/p/s_series_00447_4_07;1369
2017.07.20;Kenny Omega vs Minoru Suzuki;http://njpwworld.com/p/s_series_00447_3_09;G1 Climax Day 2;Korakuen Hall;G1 Climax Block B Match;https://njpwworld.com/p/s_series_00447_4_09;1370
2017.07.21;Kenny Omega & Yujiro Takahashi vs Tama Tonga & Chase Owens;http://njpwworld.com/p/s_series_00447_5_03;G1 Climax Day 3;Korakuen Hall;;https://njpwworld.com/p/s_series_00447_6_03;1371
2017.07.21;Yuji Nagata vs Hirooki Goto;http://njpwworld.com/p/s_series_00447_5_05;G1 Climax Day 3;Korakuen Hall;G1 Climax Block A Match;https://njpwworld.com/p/s_series_00447_6_05;1372
2017.07.21;Togi Makabe vs Tomohiro Ishii;http://njpwworld.com/p/s_series_00447_5_06;G1 Climax Day 3;Korakuen Hall;G1 Climax Block A Match;https://njpwworld.com/p/s_series_00447_6_06;1373
2017.07.21;Kota Ibushi vs Zack Sabre Jr.;http://njpwworld.com/p/s_series_00447_5_07;G1 Climax Day 3;Korakuen Hall;G1 Climax Block A Match;https://njpwworld.com/p/s_series_00447_6_07;1374
2017.07.21;Tetsuya Naito vs YOSHI-HASHI;http://njpwworld.com/p/s_series_00447_5_09;G1 Climax Day 3;Korakuen Hall;G1 Climax Block A Match;https://njpwworld.com/p/s_series_00447_6_09;1375
2017.07.22;Hiroshi Tanahashi & Katsuya Kitamura vs Yuji Nagata & Tomoyuki Oka;http://njpwworld.com/p/s_series_00447_7_03;G1 Climax Day 4;Korakuen Hall;;https://njpwworld.com/p/s_series_00447_8_03;1376
2017.07.22;Juice Robinson vs EVIL;http://njpwworld.com/p/s_series_00447_7_06;G1 Climax Day 4;Korakuen Hall;G1 Climax Block B Match;https://njpwworld.com/p/s_series_00447_8_06;1377
2017.07.22;Minoru Suzuki vs SANADA;http://njpwworld.com/p/s_series_00447_7_07;G1 Climax Day 4;Korakuen Hall;G1 Climax Block B Match;https://njpwworld.com/p/s_series_00447_8_07;1378
2017.07.22;Kenny Omega vs Tama Tonga;http://njpwworld.com/p/s_series_00447_7_08;G1 Climax Day 4;Korakuen Hall;G1 Climax Block B Match;https://njpwworld.com/p/s_series_00447_8_08;1379
2017.07.22;Michael Elgin vs Kazuchika Okada;http://njpwworld.com/p/s_series_00447_7_09;G1 Climax Day 4;Korakuen Hall;G1 Climax Block B Match;https://njpwworld.com/p/s_series_00447_8_09;1380
2017.07.23;Kazuchika Okada & Gedo vs SANADA & BUSHI;http://njpwworld.com/p/s_series_00447_9_05;G1 Climax Day 5;Tokyo Machida Gym;;;1381
2017.07.23;YOSHI-HASHI vs Zack Sabre Jr.;http://njpwworld.com/p/s_series_00447_9_06;G1 Climax Day 5;Tokyo Machida Gym;G1 Climax Block A Match;;1382
2017.07.23;Hiroshi Tanahashi vs Yuji Nagata;http://njpwworld.com/p/s_series_00447_9_07;G1 Climax Day 5;Tokyo Machida Gym;G1 Climax Block A Match;;1383
2017.07.23;Kota Ibushi vs Tomohiro Ishii;http://njpwworld.com/p/s_series_00447_9_09;G1 Climax Day 5;Tokyo Machida Gym;G1 Climax Block A Match;;1384
2017.07.23;Togi Makabe vs Hirooki Goto;http://njpwworld.com/p/s_series_00447_9_10;G1 Climax Day 5;Tokyo Machida Gym;G1 Climax Block A Match;;1385
2017.07.25;Tomoyuki Oka & Katsuya Kitamura vs Tomohiro Ishii & YOSHI-HASHI;http://njpwworld.com/p/s_series_00447_10_02;G1 Climax Day 6;Fukushima Big Palette ;;;1386
2017.07.25;Yuji Nagata & Hirai Kawato vs Tetsuya Naito & Hiromu Takahashi;http://njpwworld.com/p/s_series_00447_10_03;G1 Climax Day 6;Fukushima Big Palette ;;;1387
2017.07.25;Satoshi Kojima vs Michael Elgin;http://njpwworld.com/p/s_series_00447_10_06;G1 Climax Day 6;Fukushima Big Palette ;G1 Climax Block B Match;;1388
2017.07.25;Juice Robinson vs Minoru Suzuki;http://njpwworld.com/p/s_series_00447_10_08;G1 Climax Day 6;Fukushima Big Palette ;G1 Climax Block B Match;;1389
2017.07.25;Kenny Omega vs Toru Yano;http://njpwworld.com/p/s_series_00447_10_09;G1 Climax Day 6;Fukushima Big Palette ;G1 Climax Block B Match;;1390
2017.07.25;Kazuchika Okada vs SANADA;http://njpwworld.com/p/s_series_00447_10_10;G1 Climax Day 6;Fukushima Big Palette ;G1 Climax Block B Match;;1391
2017.07.26;Tomohiro Ishii vs YOSHI-HASHI;http://njpwworld.com/p/s_series_00447_11_06;G1 Climax Day 7;Sendai Sun Plaza Hall;G1 Climax Block A Match;;1392
2017.07.26;Togi Makabe vs Kota Ibushi;http://njpwworld.com/p/s_series_00447_11_08;G1 Climax Day 7;Sendai Sun Plaza Hall;G1 Climax Block A Match;;1393
2017.07.26;Yuji Nagata vs Tetsuya Naito;http://njpwworld.com/p/s_series_00447_11_09;G1 Climax Day 7;Sendai Sun Plaza Hall;G1 Climax Block A Match;;1394
2017.07.26;Hiroshi Tanahashi vs Hirooki Goto;http://njpwworld.com/p/s_series_00447_11_10;G1 Climax Day 7;Sendai Sun Plaza Hall;G1 Climax Block A Match;;1395
2017.07.27;Juice Robinson vs Tama Tonga;http://njpwworld.com/p/s_series_00447_12_06;G1 Climax Day 8;Niigata Aore Nagaoka;G1 Climax Block B Match;;1396
2017.07.27;Minoru Suzuki vs EVIL;http://njpwworld.com/p/s_series_00447_12_08;G1 Climax Day 8;Niigata Aore Nagaoka;G1 Climax Block B Match;;1397
2017.07.27;Satoshi Kojima vs Kazuchika Okada;http://njpwworld.com/p/s_series_00447_12_09;G1 Climax Day 8;Niigata Aore Nagaoka;G1 Climax Block B Match;;1398
2017.07.27;Michael Elgin vs Kenny Omega;http://njpwworld.com/p/s_series_00447_12_10;G1 Climax Day 8;Niigata Aore Nagaoka;G1 Climax Block B Match;;1399
2017.07.29;Kota Ibushi vs Bad Luck Fale;http://njpwworld.com/p/s_series_00447_13_07;G1 Climax Day 9;Aichi Prefectural Gym;G1 Climax Block A Match;;1400
2017.07.29;Hirooki Goto vs Zack Sabre Jr.;http://njpwworld.com/p/s_series_00447_13_08;G1 Climax Day 9;Aichi Prefectural Gym;G1 Climax Block A Match;;1401
2017.07.29;Hiroshi Tanahashi vs YOSHI-HASHI;http://njpwworld.com/p/s_series_00447_13_09;G1 Climax Day 9;Aichi Prefectural Gym;G1 Climax Block A Match;;1402
2017.07.29;Tomohiro Ishii vs Tetsuya Naito;http://njpwworld.com/p/s_series_00447_13_10;G1 Climax Day 9;Aichi Prefectural Gym;G1 Climax Block A Match;;1403
2017.07.30;Michael Elgin vs SANADA;http://njpwworld.com/p/s_series_00447_14_08;G1 Climax Day 10;Gifu Industrial Hall;G1 Climax Block B Match;;1404
2017.07.30;Satoshi Kojima vs Kenny Omega;http://njpwworld.com/p/s_series_00447_14_09;G1 Climax Day 10;Gifu Industrial Hall;G1 Climax Block B Match;;1405
2017.07.30;Juice Robinson vs Kazuchika Okada;http://njpwworld.com/p/s_series_00447_14_10;G1 Climax Day 10;Gifu Industrial Hall;G1 Climax Block B Match;;1406
2017.08.01;YOSHI-HASHI vs Bad Luck Fale;http://njpwworld.com/p/s_series_00447_15_06;G1 Climax Day 11;Kagoshima Arena;G1 Climax Block A Match;;1407
2017.08.01;Togi Makabe vs Zack Sabre Jr.;http://njpwworld.com/p/s_series_00447_15_07;G1 Climax Day 11;Kagoshima Arena;G1 Climax Block A Match;;1408
2017.08.01;Yuji Nagata vs Tomohiro Ishii;http://njpwworld.com/p/s_series_00447_15_08;G1 Climax Day 11;Kagoshima Arena;G1 Climax Block A Match;;1409
2017.08.01;Hirooki Goto vs Tetsuya Naito;http://njpwworld.com/p/s_series_00447_15_09;G1 Climax Day 11;Kagoshima Arena;G1 Climax Block A Match;;1410
2017.08.01;Hiroshi Tanahashi vs Kota Ibushi;http://njpwworld.com/p/s_series_00447_15_10;G1 Climax Day 11;Kagoshima Arena;G1 Climax Block A Match;;1411
2017.08.02;Sabre, Taichi & El Desperado vs Naito, BUSHI & Hiromu;http://njpwworld.com/p/s_series_00447_16_04;G1 Climax Day 12;Fukuoka National Centre;;;1412
2017.08.02;Juice Robinson vs SANADA;http://njpwworld.com/p/s_series_00447_16_06;G1 Climax Day 12;Fukuoka National Centre;G1 Climax Block B Match;;1413
2017.08.02;Kazuchika Okada vs Tama Tonga;http://njpwworld.com/p/s_series_00447_16_09;G1 Climax Day 12;Fukuoka National Centre;G1 Climax Block B Match;;1414
2017.08.02;Kenny Omega vs EVIL;http://njpwworld.com/p/s_series_00447_16_10;G1 Climax Day 12;Fukuoka National Centre;G1 Climax Block B Match;;1415
2017.08.04;Yuji Nagata vs Kota Ibushi;http://njpwworld.com/p/s_series_00447_17_06;G1 Climax Day 13;Ehime ITEM;G1 Climax Block A Match;;1416
2017.08.04;Tomohiro Ishii vs Bad Luck Fale;http://njpwworld.com/p/s_series_00447_17_07;G1 Climax Day 13;Ehime ITEM;G1 Climax Block A Match;;1417
2017.08.04;Zack Sabre Jr. vs Tetsuya Naito;http://njpwworld.com/p/s_series_00447_17_09;G1 Climax Day 13;Ehime ITEM;G1 Climax Block A Match;;1418
2017.08.05;Nagata, Umino & Yagi vs Sabre, Taichi & El Desperado;http://njpwworld.com/p/s_series_00447_18_02;G1 Climax Day 14;Osaka Prefectural Gym;;;1419
2017.08.05;Satoshi Kojima vs SANADA;http://njpwworld.com/p/s_series_00447_18_07;G1 Climax Day 14;Osaka Prefectural Gym;G1 Climax Block B Match;;1420
2017.08.05;Juice Robinson vs Kenny Omega;http://njpwworld.com/p/s_series_00447_18_09;G1 Climax Day 14;Osaka Prefectural Gym;G1 Climax Block B Match;;1421
2017.08.05;Kazuchika Okada vs EVIL;http://njpwworld.com/p/s_series_00447_18_10;G1 Climax Day 14;Osaka Prefectural Gym;G1 Climax Block B Match;;1422
2017.08.06;Yuji Nagata vs Zack Sabre Jr.;http://njpwworld.com/p/s_series_00447_19_06;G1 Climax Day 15;Act City Hamamatsu;G1 Climax Block A Match;;1423
2017.08.06;Kota Ibushi vs YOSHI-HASHI;http://njpwworld.com/p/s_series_00447_19_07;G1 Climax Day 15;Act City Hamamatsu;G1 Climax Block A Match;;1424
2017.08.06;Togi Makabe vs Tetsuya Naito;http://njpwworld.com/p/s_series_00447_19_09;G1 Climax Day 15;Act City Hamamatsu;G1 Climax Block A Match;;1425
2017.08.06;Hiroshi Tanahashi vs Tomohiro Ishii;http://njpwworld.com/p/s_series_00447_19_10;G1 Climax Day 15;Act City Hamamatsu;G1 Climax Block A Match;;1426
2017.08.08;Ibushi, Makabe & Kawato vs Ishii, Goto & YOSHI-HASHI;http://njpwworld.com/p/s_series_00447_20_04;G1 Climax Day 16;Yokohama Cultural Gym;;;1427
2017.08.08;Michael Elgin vs EVIL;http://njpwworld.com/p/s_series_00447_20_08;G1 Climax Day 16;Yokohama Cultural Gym;G1 Climax Block B Match;;1428
2017.08.08;Kenny Omega vs SANADA;http://njpwworld.com/p/s_series_00447_20_09;G1 Climax Day 16;Yokohama Cultural Gym;G1 Climax Block B Match;;1429
2017.08.08;Kazuchika Okada vs Minoru Suzuki;http://njpwworld.com/p/s_series_00447_20_10;G1 Climax Day 16;Yokohama Cultural Gym;G1 Climax Block B Match;;1430
2017.08.11;Oka, Kitamura & Kawato vs Suzuki, Taichi & El Desperado;http://njpwworld.com/p/s_series_00447_21_01;G1 Climax Day 17;Ryogoku Kokugikan;;https://njpwworld.com/p/s_series_00447_22_01;1431
2017.08.11;Taguchi, Ricochet, Elgin & War Machine vs Cody, Hangman, Chase & The Bucks;http://njpwworld.com/p/s_series_00447_21_04;G1 Climax Day 17;Ryogoku Kokugikan;;https://njpwworld.com/p/s_series_00447_22_04;1432
2017.08.11;Yuji Nagata vs Bad Luck Fale;http://njpwworld.com/p/s_series_00447_21_06;G1 Climax Day 17;Ryogoku Kokugikan;G1 Climax Block A Match;https://njpwworld.com/p/s_series_00447_22_06;1433
2017.08.11;Tomohiro Ishii vs Zack Sabre Jr. ;http://njpwworld.com/p/s_series_00447_21_08;G1 Climax Day 17;Ryogoku Kokugikan;G1 Climax Block A Match;https://njpwworld.com/p/s_series_00447_22_08;1434
2017.08.11;Kota Ibushi vs Hirooki Goto;http://njpwworld.com/p/s_series_00447_21_09;G1 Climax Day 17;Ryogoku Kokugikan;G1 Climax Block A Match;https://njpwworld.com/p/s_series_00447_22_09;1435
2017.08.11;Hiroshi Tanahashi vs Tetsuya Naito;http://njpwworld.com/p/s_series_00447_21_10;G1 Climax Day 17;Ryogoku Kokugikan;G1 Climax Block A Match;https://njpwworld.com/p/s_series_00447_22_10;1436
2017.08.12;Taguchi, Ricochet, War Machine & Kitamura vs Cody, Hangman & The Bucks;http://njpwworld.com/p/s_series_00447_23_04;G1 Climax Day 18;Ryogoku Kokugikan;;https://njpwworld.com/p/s_series_00447_24_04;1437
2017.08.12;Michael Elgin vs Juice Robinson;http://njpwworld.com/p/s_series_00447_23_06;G1 Climax Day 18;Ryogoku Kokugikan;G1 Climax Block B Match;https://njpwworld.com/p/s_series_00447_24_06;1438
2017.08.12;Tama Tonga vs SANADA;http://njpwworld.com/p/s_series_00447_23_07;G1 Climax Day 18;Ryogoku Kokugikan;G1 Climax Block B Match;https://njpwworld.com/p/s_series_00447_24_07;1439
2017.08.12;Satoshi Kojima vs EVIL;http://njpwworld.com/p/s_series_00447_23_09;G1 Climax Day 18;Ryogoku Kokugikan;G1 Climax Block B Match;https://njpwworld.com/p/s_series_00447_24_09;1440
2017.08.12;Kazuchika Okada vs Kenny Omega;http://njpwworld.com/p/s_series_00447_23_10;G1 Climax Day 18;Ryogoku Kokugikan;G1 Climax Block B Match;https://njpwworld.com/p/s_series_00447_24_10;1441
2017.08.13;The Young Bucks (c) vs Ryusuke Taguchi & Ricochet;http://njpwworld.com/p/s_series_00447_25_05;G1 Climax Day 19;Ryogoku Kokugikan;IWGP Jr. Heavyweight Tag Titles;https://njpwworld.com/p/s_series_00447_26_05;1442
2017.08.13;War Machine (c) vs Cody & Hangman Paige;http://njpwworld.com/p/s_series_00447_25_06;G1 Climax Day 19;Ryogoku Kokugikan;IWGP Heavyweight Tag Titles;https://njpwworld.com/p/s_series_00447_26_06;1443
2017.08.13;Tanahashi, Ibushi & Elgin vs Suzuki, Sabre & Iizuka;http://njpwworld.com/p/s_series_00447_25_07;G1 Climax Day 19;Ryogoku Kokugikan;;https://njpwworld.com/p/s_series_00447_26_07;1444
2017.08.13;Okada, Ishii, Yano & Gedo vs SANADA, EVIL, BUSHI & Hiromu;http://njpwworld.com/p/s_series_00447_25_08;G1 Climax Day 19;Ryogoku Kokugikan;;https://njpwworld.com/p/s_series_00447_26_08;1445
2017.08.13;Kenny Omega vs Tetsuya Naito;http://njpwworld.com/p/s_series_00447_25_09;G1 Climax Day 19;Ryogoku Kokugikan;G1 Climax FINAL;https://njpwworld.com/p/s_series_00447_26_09;1446
2017.08.18;KUSHIDA (c) vs Titan;https://njpwworld.com/p/s_arc_58_01_02;ROH War of the Worlds UK;York Hall, London;ROH World TV Title;;1447
2017.08.19;The Young Bucks (c) vs Christopher Daniels & Frankie Kazarian;https://njpwworld.com/p/s_arc_58_02_03;ROH War of the Worlds UK;Liverpool Olympia;ROH World Tag Titles ;;1448
2017.08.28;Minoru Suzuki vs Yoshinobu Kanemaru;http://njpwworld.com/p/s_series_00448_1_1;TAKA & Taichi Season 2;Shinjuku FACE;;;1449
2017.08.28;Hiromu Takahashi & BUSHI vs TAKA Michinoku & Taichi;http://njpwworld.com/p/s_series_00448_1_1;TAKA & Taichi Season 2;Shinjuku FACE;2/3 Falls;;1450
2017.09.07;Shota Umino vs Tetsuhiro Yagi;http://njpwworld.com/p/s_series_00449_1_01;Road to Destruction;Korakuen Hall;;;1451
2017.09.07;War Machine & Juice vs Tama Tonga, Tanga Loa & Leo Tonga;http://njpwworld.com/p/s_series_00449_1_05;Road to Destruction;Korakuen Hall;;;1452
2017.09.07;Okada, Ishii, Yano, Ospreay & Rocky vs Naito, EVIL, SANADA, BUSHI & Hiromu;http://njpwworld.com/p/s_series_00449_1_07;Road to Destruction;Korakuen Hall;Elimination Match;;1453
2017.09.09;Will Ospreay & Rocky Romero vs Hiromu Takahashi & BUSHI;http://njpwworld.com/p/s_series_00449_2_04;Road to Destruction;Korakuen Hall;;;1454
2017.09.09;Okada, Ishii & Yano vs Naito, EVIL & SANADA;http://njpwworld.com/p/s_series_00449_2_06;Road to Destruction;Korakuen Hall;;;1455
2017.09.09;Tana/Elgin/KUSHIDA/Taguchi/Ricochet vs MiSu/Iizuka/Despy/Kanemaru/Taichi;http://njpwworld.com/p/s_series_00449_2_07;Road to Destruction;Korakuen Hall;Elimination Match;;1456
2017.09.10;War Machine (c) vs G.O.D. vs K.E.S. ;http://njpwworld.com/p/s_series_00450_1_06;Destruction in Fukushima;Azuma General Gym;IWGP Heavyweight Tag Titles;;1457
2017.09.10;Tomohiro Ishii & Will Ospreay vs Tetsuya Naito & Hiromu Takahashi;http://njpwworld.com/p/s_series_00450_1_07;Destruction in Fukushima;Azuma General Gym;;;1458
2017.09.10;EVIL, SANADA & BUSHI (c) vs Okada, Yano & Romero;http://njpwworld.com/p/s_series_00450_1_08;Destruction in Fukushima;Azuma General Gym;NEVER Openweight Trios Titles;;1459
2017.09.10;Minoru Suzuki (c) vs Michael Elgin;http://njpwworld.com/p/s_series_00450_1_09;Destruction in Fukushima;Azuma General Gym;NEVER Openweight Title;;1460
2017.09.16;RPG Vice vs Yujiro Takahashi & Chase Owens;http://njpwworld.com/p/s_series_00451_1_03;Destruction in Hiroshima;Hiroshima Sun Plaza;;https://njpwworld.com/p/s_series_00451_2_03;1461
2017.09.16;Ryusuke Taguchi & Ricochet (c) vs Taichi & Yoshinobu Kanemaru;http://njpwworld.com/p/s_series_00451_1_05;Destruction in Hiroshima;Hiroshima Sun Plaza;IWGP Jr. Heavyweight Tag Titles;https://njpwworld.com/p/s_series_00451_2_05;1462
2017.09.16;War Machine (c) vs G.O.D. vs K.E.S. ;http://njpwworld.com/p/s_series_00451_1_06;Destruction in Hiroshima;Hiroshima Sun Plaza;IWGP Heavyweight Tag Titles;https://njpwworld.com/p/s_series_00451_2_06;1463
2017.09.16;KUSHIDA (c) vs El Desperado;http://njpwworld.com/p/s_series_00451_1_08;Destruction in Hiroshima;Hiroshima Sun Plaza;IWGP Jr. Heavyweight Titles;https://njpwworld.com/p/s_series_00451_2_08;1464
2017.09.16;Hiroshi Tanahashi (c) vs Zack Sabre Jr.;http://njpwworld.com/p/s_series_00451_1_09;Destruction in Hiroshima;Hiroshima Sun Plaza;IWGP Intercontinental Title;https://njpwworld.com/p/s_series_00451_2_09;1465
2017.09.22;KUSHIDA (c) vs Kenny King;https://njpwworld.com/p/s_a_59_05;Death Before Dishonor;Sam's Town Hotel;ROH World TV Title;;1466
2017.09.24;Trent Baretta vs Yujiro Takahashi;http://njpwworld.com/p/s_series_00452_1_1;Destruction in Kobe;Kobe World Hall;;https://njpwworld.com/p/s_series_00452_2_04;1467
2017.09.24;Hiroshi Tanahashi & Michael Elgin vs Kota Ibushi & David Finlay;http://njpwworld.com/p/s_series_00452_1_1;Destruction in Kobe;Kobe World Hall;;https://njpwworld.com/p/s_series_00452_2_06;1468
2017.09.24;War Machine (c) vs G.O.D. vs K.E.S. ;http://njpwworld.com/p/s_series_00452_1_1;Destruction in Kobe;Kobe World Hall;;https://njpwworld.com/p/s_series_00452_2_05;1469
2017.09.24;Kazuchika Okada & Will Ospreay vs EVIL & Hiromu Takahashi;http://njpwworld.com/p/s_series_00452_1_1;Destruction in Kobe;Kobe World Hall;;https://njpwworld.com/p/s_series_00452_2_08;1470
2017.09.24;Kenny Omega (c) vs Juice Robinson;http://njpwworld.com/p/s_series_00452_1_1;Destruction in Kobe;Kobe World Hall;IWGP US Heavyweight Title;https://njpwworld.com/p/s_series_00452_2_09;1471
2017.10.09;Ricochet & Taguchi (c) vs SHO & YOH;https://njpwworld.com/p/s_series_00453_1_03;King of Pro-Wrestling;Ryogoku Kokugikan;IWGP Jr. Heavyweight Tag Titles;https://njpwworld.com/p/s_series_00453_2_03;1472
2017.10.09;K.E.S. (c) vs War Machine vs Guerrillas of Destiny;https://njpwworld.com/p/s_series_00453_1_04;King of Pro-Wrestling;Ryogoku Kokugikan;IWGP Heavyweight Tag Title Elimination;https://njpwworld.com/p/s_series_00453_2_04;1473
2017.10.09;Hiroshi Tanahashi & Togi Makabe vs Juice Robinson & Kota Ibushi;https://njpwworld.com/p/s_series_00453_1_06;King of Pro-Wrestling;Ryogoku Kokugikan;;https://njpwworld.com/p/s_series_00453_2_06;1474
2017.10.09;KUSHIDA (c) vs Will Ospreay;https://njpwworld.com/p/s_series_00453_1_07;King of Pro-Wrestling;Ryogoku Kokugikan;IWGP Jr. Heavyweight Title;https://njpwworld.com/p/s_series_00453_2_07;1475
2017.10.09;Tetsuya Naito vs Tomohiro Ishii;https://njpwworld.com/p/s_series_00453_1_08;King of Pro-Wrestling;Ryogoku Kokugikan;Tokyo Dome no.1 Contendership;https://njpwworld.com/p/s_series_00453_2_08;1476
2017.10.09;Kazuchika Okada (c) vs EVIL;https://njpwworld.com/p/s_series_00453_1_09;King of Pro-Wrestling;Ryogoku Kokugikan;IWGP Heavyweight Title;https://njpwworld.com/p/s_series_00453_2_09;1477
2017.10.12;Tomoyuki Oka vs Shota Umino;https://njpwworld.com/p/s_series_00454_03;Lion's Gate Project: 8;Shinjuku FACE;Young Lion Cup Match;;1478
2017.10.12;Yuji Nagata vs Daisuke Kanehira;https://njpwworld.com/p/s_series_00454_06;Lion's Gate Project: 8;Shinjuku FACE;;;1479
2017.10.12;Mark Briscoe & War Machine vs Minoru Suzuki & K.E.S.;https://njpwworld.com/p/s_61_01_02;Global Wars Night 1;Buffalo, NY;;;1480
2017.10.12;Will Ospreay vs Punisher Martinez;https://njpwworld.com/p/s_61_01_05;Global Wars Night 1;Buffalo, NY;;;1481
2017.10.13;Jay Lethal vs Jay White;https://njpwworld.com/p/s_61_02_02;Global Wars Night 2;Pittsburgh, PA;;;1482
2017.10.13;War Machine vs K.E.S.;https://njpwworld.com/p/s_61_02_04;Global Wars Night 2;Pittsburgh, PA;;;1483
2017.10.13;Cody, Kenny Omega & Marty Scurll (c) vs Toru Yano, Will Ospreay & YOSHI;https://njpwworld.com/p/s_61_02_06;Global Wars Night 2;Pittsburgh, PA;ROH World Six Man Tag Titles;;1484
2017.10.15;Hiromu Takahashi vs Marty Scurll;https://njpwworld.com/p/s_61_04_01;Global Wars Night 4;Chicago, IL;;;1485
2017.10.15;Will Ospreay vs Flip Gordon;https://njpwworld.com/p/s_61_04_04;Global Wars Night 4;Chicago, IL;;;1486
2017.10.15;Kenny Omega (c) vs YOSHI-HASHI;https://njpwworld.com/p/s_61_04_05;Global Wars Night 4;Chicago, IL;IWGP US Heavyweight Title;;1487
2017.10.21;Okada, Ishii, Gedo, YOH & SHO vs Naito, EVIL, SANADA, BUSHI & Hiromu;https://njpwworld.com/p/s_series_00455_1_06;Road to Power Struggle;Togane Arena;;;1488
2017.10.21;Yuji Nagata vs Manabu Nakanishi;https://njpwworld.com/p/s_series_00455_1_07;Road to Power Struggle;Togane Arena;Nagata & Nakanishi 25th Anniversary;;1489
2017.10.21;Okada, Ishii & YOSHI-HASHI vs Naito, EVIL & SANADA;https://njpwworld.com/p/s_series_00455_2_05;Road to Power Struggle;Korakuen Hall;;;1490
2017.10.21;KUSHIDA & Kawato vs YOH & SHO;https://njpwworld.com/p/s_series_00455_2_06;Road to Power Struggle;Korakuen Hall;Super Jr. Tag Tournament First Round;;1491
2017.10.21;Dragon Lee & Titan vs BUSHI & Hiromu Takahashi;https://njpwworld.com/p/s_series_00455_2_07;Road to Power Struggle;Korakuen Hall;Super Jr. Tag Tournament First Round;;1492
2017.10.29;Tanahashi, KUSHIDA & Kawato vs Ibushi, Dragon Lee & Titan;https://njpwworld.com/p/s_series_00455_3_04;Road to Power Struggle;Korakuen Hall;;;1493
2017.10.29;Okada, Ishii, Romero, YOH & SHO vs Naito, SANADA, EVIL, BUSHI & Hiromu;https://njpwworld.com/p/s_series_00455_3_05;Road to Power Struggle;Korakuen Hall;;;1494
2017.10.29;Liger & Tiger Mask vs El Desperado & Yoshinobu Kanemaru;https://njpwworld.com/p/s_series_00455_3_06;Road to Power Struggle;Korakuen Hall;Super Jr. Tag Tournament First Round;;1495
2017.10.30;YOH & SHO vs BUSHI & Hiromu Takahashi;https://njpwworld.com/p/s_series_00455_4_07;Road to Power Struggle;Korakuen Hall;Super Jr. Tag Tournament Semi-Final;;1496
2017.11.05;The Young Bucks vs Dragon Lee & Titan;https://njpwworld.com/p/s_series_00456_1_01;Power Struggle;Osaka EDION Arena;;https://njpwworld.com/p/s_series_00456_2_01;1497
2017.11.05;Ryusuke Taguchi & ACH vs YOH & SHO;https://njpwworld.com/p/s_series_00456_1_04;Power Struggle;Osaka EDION Arena;Super Jr. Tag Tournament FINAL;https://njpwworld.com/p/s_series_00456_2_04;1498
2017.11.05;Okada, Ishii, Goto, Gedo & YOSHI vs Naito, EVIL, SANADA, BUSHI & Hiromu;https://njpwworld.com/p/s_series_00456_1_05;Power Struggle;Osaka EDION Arena;;https://njpwworld.com/p/s_series_00456_2_05;1499
2017.11.05;Will Ospreay (c) vs Marty Scurll;https://njpwworld.com/p/s_series_00456_1_07;Power Struggle;Osaka EDION Arena;IWGP Jr. Heavyweight Title;https://njpwworld.com/p/s_series_00456_2_07;1500
2017.11.05;Kenny Omega (c) vs Trent Baretta;https://njpwworld.com/p/s_series_00456_1_08;Power Struggle;Osaka EDION Arena;IWGP US Heavyweight Title;https://njpwworld.com/p/s_series_00456_2_08;1501
2017.11.05;Hiroshi Tanahashi (c) vs Kota Ibushi;https://njpwworld.com/p/s_series_00456_1_09;Power Struggle;Osaka EDION Arena;IWGP Intercontinental Title;https://njpwworld.com/p/s_series_00456_2_09;1502
2017.11.09;Matt Riddle vs El Desperado;https://njpwworld.com/p/s_archive_69_01_03;Global Wars UK Night 1;York Hall, London;;;1503
2017.11.09;Tetsuya Naito vs Marty Scurll;https://njpwworld.com/p/s_archive_69_01_04;Global Wars UK Night 1;York Hall, London;;;1504
2017.11.09;Tomohiro Ishii vs Keith Lee;https://njpwworld.com/p/s_archive_69_01_07;Global Wars UK Night 1;York Hall, London;;;1505
2017.11.09;Minoru Suzuki & Zack Sabre Jr. vs Hirooki Goto & Will Ospreay;https://njpwworld.com/p/s_archive_69_01_08;Global Wars UK Night 1;York Hall, London;;;1506
2017.11.10;Minoru Suzuki vs Matt Riddle;https://njpwworld.com/p/s_archive_69_02_07;Global Wars UK Night 2;Walthamstow, London;;;1507
2017.11.10;Zack Sabre Jr. (c) vs Will Ospreay;https://njpwworld.com/p/s_archive_69_02_08;Global Wars UK Night 2;Walthamstow, London;RPW Undisputed British Heavyweight Title;;1508
2017.11.11;Kazuchika Okada vs Slex;https://njpwworld.com/p/s_archive_71_1_01;MCW November Rain;Melbourne, Australia;;;1509
2017.11.16;Tomoyuki Oka vs Ren Narita;https://njpwworld.com/p/s_series_00457_1_01;Lion's Gate Project: 9;Shinjuku FACE;Young Lion Cup Match;;1510
2017.11.16;Katsuya Kitamura vs Shota Umino;https://njpwworld.com/p/s_series_00457_1_02;Lion's Gate Project: 9;Shinjuku FACE;Young Lion Cup Match;;1511
2017.11.16;Ryusuke Taguchi vs GO Asakawa;https://njpwworld.com/p/s_series_00457_1_05;Lion's Gate Project: 9;Shinjuku FACE;;;1512
